{
  "version": "1.0",
  "kind": "OFFICIAL_CURRICULUM_REGISTRY",
  "authority": "Millî Eğitim Bakanlığı",
  "curriculum_model": "Türkiye Yüzyılı Maarif Modeli 2024",
  "subject": "Biyoloji",
  "grades": [
    9,
    10,
    11,
    12
  ],
  "source_document": "2024programbiy9101112Onayli.pdf",
  "source_page_count": 88,
  "total_learning_outcomes": 78,
  "grade_records": [
    {
      "grade": 9,
      "learning_outcome_count": 15,
      "themes": [
        {
          "theme_number": 1,
          "theme_name": "Yaşam",
          "content_framework": "Yaşam Bilimi: Biyoloji Sınıflandırma ve Biyoçeşitlilik",
          "learning_outcome_count": 7,
          "learning_outcomes": [
            {
              "id": "BİY.9.1.1",
              "grade": 9,
              "theme_number": 1,
              "outcome_number": 1,
              "title": "Biyolojideki dönüm noktalarının insan hayatına katkılarını sorgulayabilme",
              "content_framework": "Yaşam Bilimi: Biyoloji Sınıflandırma ve Biyoçeşitlilik",
              "key_concepts": "bilimsel yöntem, bilim etiği, prokaryot ÖĞRENME KANITLARI (Ölçme ve Değerlendirme) Öğrenme çıktıları; öğrenme günlüğü, zihin haritası, araştırma raporu, performans görevi, kontrol noktası, yapılandırılmış grid, açık uçlu soruların yer aldığı çalışma yaprağı, bilgi görseli kullanılarak dereceli puanlama anahtarı ile değerlendirilebilir.",
              "source_page": 13
            },
            {
              "id": "BİY.9.1.2",
              "grade": 9,
              "theme_number": 1,
              "outcome_number": 2,
              "title": "Bilimsel araştırma süreçlerinde bilimin doğasını yorumlayabilme",
              "content_framework": "",
              "key_concepts": "",
              "source_page": 15
            },
            {
              "id": "BİY.9.1.3",
              "grade": 9,
              "theme_number": 1,
              "outcome_number": 3,
              "title": "Bilimsel araştırmaların bilim etiğine uygunluğu ile ilgili bilgi toplayabilme",
              "content_framework": "",
              "key_concepts": "",
              "source_page": 15
            },
            {
              "id": "BİY.9.1.4",
              "grade": 9,
              "theme_number": 1,
              "outcome_number": 4,
              "title": "Çevresindeki canlıların özelliklerini bilimsel olarak gözlemleyebilme",
              "content_framework": "",
              "key_concepts": "",
              "source_page": 15
            },
            {
              "id": "BİY.9.1.5",
              "grade": 9,
              "theme_number": 1,
              "outcome_number": 5,
              "title": "Canlıları sınıflandırabilme",
              "content_framework": "",
              "key_concepts": "",
              "source_page": 15
            },
            {
              "id": "BİY.9.1.6",
              "grade": 9,
              "theme_number": 1,
              "outcome_number": 6,
              "title": "Üç üst âlem (domain) sisteminde yer alan canlıların özellikleri ile ilgili çıkarım yapabilme",
              "content_framework": "",
              "key_concepts": "",
              "source_page": 15
            },
            {
              "id": "BİY.9.1.7",
              "grade": 9,
              "theme_number": 1,
              "outcome_number": 7,
              "title": "Biyoçeşitliliği oluşturan unsurlarla ilgili bilimsel çıkarım yapabilme",
              "content_framework": "Yaşam Bilimi: Biyoloji Biyolojinin Önemi, Biyoloji Biliminin Gelişimindeki Dönüm Noktaları, Bilimin Doğası, Bilimsel Araştırma Süreçleri, Bilim Etiği, Canlıların Ortak Özellikleri (Hücresel Yapı, Organizasyon, Beslenme, Enerji Üretimi ve Tüketimi, Boşaltım, Büyüme ve Gelişme, Metabolizma, Uyarılara Tepki, Homeostazi, Üreme, Varyasyon ve Adaptasyon) Sınıflandırma ve Biyoçeşitlilik Sınıflandırmada Temel Yaklaşımlar ve Modern Sınıflandırma (Linne ve İkili Adlandırma, Sınıflandırma Kategorileri), Üç Üst Âlem (Domain) Sisteminde Yer Alan Canlılar ve Genel Özellikleri [Bakteriler, Arkeler, Ökaryotlar (Protistler, Bitkiler, Mantarlar, Hayvanlar)], Biyoçeşitlilik",
              "key_concepts": "bilimsel yöntem, bilim etiği, prokaryot, ökaryot, beslenme çeşitleri, sınıflandırma kategorileri, ikili adlandırma, domain, tür, arke, bakteri, protista, bitki, mantar, hayvan, endemik tür ÖĞRENME KANITLARI (Ölçme ve Değerlendirme) Öğrenme çıktıları; öğrenme günlüğü, zihin haritası, araştırma raporu, performans görevi, kontrol noktası, yapılandırılmış grid, açık uçlu soruların yer aldığı çalışma yaprağı, bilgi görseli kullanılarak dereceli puanlama anahtarı ile değerlendirilebilir. Öğrencilerin bilimin doğasını incelerken elde edeceği bilgileri kendi ifadeleriyle aktarması için zihin haritası kullanılabilir. Öğrencilerin oluşturacağı zihin haritaları, puanlama anahtarı ile puanlanabilir. Farklı canlıların yapısal özellikleri ile ilgili önerme sunmayı, örüntü oluşturmayı, karşılaştırma ve değerlendirme yapmayı sağlayacak açık uçlu sorular kullanılabilir. Sorulara verilecek cevaplar, puanlama anahtarı ile değerlendirilebilir. Öğrencilere çevrelerinden seçtikleri canlıların özelliklerini gözlem formu kullanarak belirli süre gözlemlemeye, gözlem verisinden hareketle biyoçeşitliliğin niteliklerine ilişkin çıkarımlarda bulunacağı araştırma raporu hazırlamaya yönelik performans görevi verilebilir. Araştırma raporu, analitik dereceli puanlama anahtarı ile değerlendirilebilir.",
              "source_page": 16
            }
          ]
        },
        {
          "theme_number": 2,
          "theme_name": "Organizasyon",
          "content_framework": "Temel Bileşenler İnorganik Moleküller Su, Mineraller Organik Moleküller Karbohidratlar: Monosakkaritler (Riboz, Deoksiriboz, Fruktoz, Glikoz, Galaktoz), Disakkaritler (Sükroz, Maltoz, Laktoz), Polisakkaritler (Glikojen, Nişasta, Selüloz, Kitin) Yağlar: Yağ Asitleri, Trigliseritler, Fosfolipitler, Steroitler Proteinler: Amino Asitlerin Yapısı, Enzimler (Basit ve Bileşik Enzimler, Aktivasyon Enerjisi, Enzim-Substrat İlişkisi), Enzimatik Reaksiyonlara Etki Eden Faktörler Nükleik Asitler: DNA ve RNA’ nın Yapısı Vitaminler: Yağda Çözünen Vitaminler, Suda Çözünen Vitaminler Hücrenin Organizasyonu Prokaryot ve Ökaryot Hücre, Hücre Zarı, Sitoplazma, Sitoplazmik Yapılar, Organeller ve Çekirdek, Hücre Zarından Madde Geçişleri (Pasif Taşıma, Difüzyon, Ozmoz, Aktif Taşıma, Endositoz, Ekzositoz), Hücreden Doku, Organ ve Sistemlerin Organizasyonu",
          "learning_outcome_count": 8,
          "learning_outcomes": [
            {
              "id": "BİY.9.2.1",
              "grade": 9,
              "theme_number": 2,
              "outcome_number": 1,
              "title": "İnorganik moleküllerin önemi hakkında bilimsel çıkarım yapabilme",
              "content_framework": "",
              "key_concepts": "",
              "source_page": 23
            },
            {
              "id": "BİY.9.2.2",
              "grade": 9,
              "theme_number": 2,
              "outcome_number": 2,
              "title": "Organik moleküllerin yapısı ve çeşitleriyle ilgili bilgi toplayabilme",
              "content_framework": "",
              "key_concepts": "",
              "source_page": 23
            },
            {
              "id": "BİY.9.2.3",
              "grade": 9,
              "theme_number": 2,
              "outcome_number": 3,
              "title": "Besinlerin yapısında karbohidrat, yağ ve protein varlığının belirlenmesiyle ilgili deney yapabilme",
              "content_framework": "",
              "key_concepts": "",
              "source_page": 23
            },
            {
              "id": "BİY.9.2.4",
              "grade": 9,
              "theme_number": 2,
              "outcome_number": 4,
              "title": "pH ve sıcaklığın enzim aktivitesini etkilediğini gösteren deney yapabilme",
              "content_framework": "",
              "key_concepts": "",
              "source_page": 23
            },
            {
              "id": "BİY.9.2.5",
              "grade": 9,
              "theme_number": 2,
              "outcome_number": 5,
              "title": "Hücre alt birimlerini ve bu birimlerin işlevleri arasındaki ilişkileri çözümleyebilme",
              "content_framework": "",
              "key_concepts": "",
              "source_page": 23
            },
            {
              "id": "BİY.9.2.6",
              "grade": 9,
              "theme_number": 2,
              "outcome_number": 6,
              "title": "Hücre zarından madde geçişlerini sınıflandırabilme",
              "content_framework": "",
              "key_concepts": "",
              "source_page": 23
            },
            {
              "id": "BİY.9.2.7",
              "grade": 9,
              "theme_number": 2,
              "outcome_number": 7,
              "title": "Küçük moleküllerin hücre zarından pasif geçişi ile ilgili deney yapabilme",
              "content_framework": "",
              "key_concepts": "",
              "source_page": 23
            },
            {
              "id": "BİY.9.2.8",
              "grade": 9,
              "theme_number": 2,
              "outcome_number": 8,
              "title": "Hücreden doku, organ ve sistemlerin organizasyonuyla ilgili tümevarımsal akıl yürütebilme",